{
  "compilers": [
    {
      "name": "macos-15-swift-6.3",
      "runner": "macos-15",
      "xcode": "26.0.1",
      "swift": "6.3.3"
    },
    {
      "name": "macos-26-swift-6.3",
      "runner": "macos-26",
      "xcode": "26.6"
    }
  ],
  "platforms": {
    "linux": [
      {
        "name": "linux-swift-6.3",
        "image": "swift:6.3.3-jammy@sha256:2f3a1d7bb74da95c4857514589667a58087fdaf34f11e424d47854bebd710cf2"
      }
    ]
  },
  "format": {
    "paths": [
      "Package.swift",
      "Sources",
      "Tests",
      "Examples"
    ]
  },
  "demo": {
    "product": "swift-sh"
  }
}
