{
  "compilers": [
    {
      "name": "macos-15-swift-6.2",
      "runner": "macos-15",
      "xcode": "26.0.1"
    },
    {
      "name": "macos-26-swift-6.3",
      "runner": "macos-26",
      "xcode": "26.6"
    }
  ],
  "timeout_minutes": 90,
  "docs": {
    "targets": [
      "Codex",
      "CodexAppServerClient",
      "CodexAppServerHummingbird",
      "CodexAppServerNIO",
      "CodexAppServerProtocol",
      "CodexAppServerRuntime",
      "CodexAppServerStdio",
      "CodexAppServerURLSession",
      "CodexAppServerVapor",
      "CodexExec",
      "CodexMCP"
    ]
  },
  "build_system": "native",
  "commands": [
    {
      "name": "repository",
      "run": "brew install ripgrep && scripts/verify-public-repository.sh"
    },
    {
      "name": "schema",
      "run": "scripts/verify-schema-snapshot.sh"
    },
    {
      "name": "dependencies",
      "run": "scripts/verify-dependency-manifest.py"
    },
    {
      "name": "stress",
      "run": "scripts/verify-native-build-and-test.sh"
    }
  ],
  "format": {
    "paths": [
      "Package.swift",
      "Sources",
      "Tests",
      "Plugins"
    ]
  }
}
