{
  "compilers": [
    {
      "name": "macos-15-swift-6.0",
      "runner": "macos-15",
      "xcode": "16.2"
    },
    {
      "name": "macos-26-swift-6.3",
      "runner": "macos-26",
      "xcode": "26.6"
    }
  ],
  "platforms": {
    "apple": [
      {
        "name": "ios-build",
        "platform": "iOS",
        "scheme": "swift-userdefault-Package"
      }
    ]
  },
  "docs": {
    "targets": [
      "UserDefault",
      "UserDefaultUtils"
    ]
  },
  "test_configurations": [
    "debug",
    "release"
  ]
}
