{
  "compilers": [
    {
      "name": "macos-26-swift-6.3",
      "runner": "macos-26",
      "xcode": "26.6"
    }
  ],
  "docs": {
    "targets": [
      "InterfaceDistiller"
    ]
  },
  "build_system": "native",
  "demo": {
    "product": "interface-distiller"
  },
  "commands": [
    {
      "name": "linux-host",
      "runner": "ubuntu-24.04",
      "run": "scripts/check-linux"
    }
  ]
}
