{
  "compilers": [
    {
      "name": "macos-15-swift-6.2",
      "runner": "macos-15",
      "xcode": "26.0.1"
    },
    {
      "name": "macos-26-swift-6.3",
      "runner": "macos-26",
      "xcode": "26.6"
    }
  ],
  "timeout_minutes": 90,
  "platforms": {
    "linux": [
      {
        "name": "linux-swift-6.2",
        "image": "swift:6.2.4-noble@sha256:eccc7a97f9b9881d9659e2e788081fd7675f86d39793b51200bfb178398b3784"
      }
    ]
  },
  "docs": {
    "targets": [
      "JSONSchema",
      "JSONSchemaBuilder",
      "JSONSchemaConversion",
      "JSONSchemaFoundationModels",
      "JSONValue"
    ]
  },
  "format": {
    "paths": [
      "Package.swift",
      "Sources",
      "Tests",
      "Plugins",
      "Benchmarks"
    ]
  }
}
